#RANK	ID	GENE_SYMBOL	ENTREZ_GENE_ID	MOI	P-VALUE	EXOMISER_GENE_COMBINED_SCORE	EXOMISER_GENE_PHENO_SCORE	EXOMISER_GENE_VARIANT_SCORE	HUMAN_PHENO_SCORE	MOUSE_PHENO_SCORE	FISH_PHENO_SCORE	WALKER_SCORE	PHIVE_ALL_SPECIES_SCORE	OMIM_SCORE	MATCHES_CANDIDATE_GENE	HUMAN_PHENO_EVIDENCE	MOUSE_PHENO_EVIDENCE	FISH_PHENO_EVIDENCE	HUMAN_PPI_EVIDENCE	MOUSE_PPI_EVIDENCE	FISH_PPI_EVIDENCE
35	PI4KA_AR	PI4KA	5297	AR	0.2061	0.0312	0.5063	0.4997	0.5058	0.0000	0.0000	0.5063	0.5063	1.0000	0	Gastrointestinal defects and immunodeficiency syndrome 2 (OMIM:619708): Brachydactyly (HP:0001156)-Overlapping fingers (HP:0010557), Craniosynostosis (HP:0001363)-Dolichocephaly (HP:0000268), Broad hallux (HP:0010055)-Overlapping fingers (HP:0010557), Broad thumb (HP:0011304)-Overlapping fingers (HP:0010557), 			Proximity to INPP5E associated with Joubert syndrome (ORPHA:475): Brachydactyly (HP:0001156)-Foot polydactyly (HP:0001829), Craniosynostosis (HP:0001363)-Biparietal narrowing (HP:0004422), Broad hallux (HP:0010055)-Foot polydactyly (HP:0001829), Broad thumb (HP:0011304)-Hand polydactyly (HP:0001161), 	Proximity to INPP5E Brachydactyly (HP:0001156)-postaxial polydactyly (MP:0009744), Craniosynostosis (HP:0001363)-delayed endochondral bone ossification (MP:0003419), Broad hallux (HP:0010055)-postaxial polydactyly (MP:0009744), Broad thumb (HP:0011304)-abnormal phalanx morphology (MP:0005306), 	
36	CNNM3_AR	CNNM3	26505	AR	0.2073	0.0308	0.5085	0.4956	0.0000	0.0000	0.0000	0.5085	0.5085	1.0000	0					Proximity to CRABP2 Brachydactyly (HP:0001156)-polydactyly (MP:0000562), Broad hallux (HP:0010055)-polydactyly (MP:0000562), Broad thumb (HP:0011304)-polydactyly (MP:0000562), 	
37	LAMA2_AR	LAMA2	3908	AR	0.2078	0.0303	0.5038	0.4992	0.0000	0.4874	0.0000	0.5038	0.5038	1.0000	0		Craniosynostosis (HP:0001363)-increased cranium width (MP:0000441), 			Proximity to LAMA5 Brachydactyly (HP:0001156)-abnormal digit morphology (MP:0002110), Broad hallux (HP:0010055)-abnormal digit morphology (MP:0002110), Broad thumb (HP:0011304)-abnormal digit morphology (MP:0002110), 	
38	EP400_AR	EP400	57634	AR	0.2084	0.0301	0.5049	0.4972	0.0000	0.0000	0.0000	0.5049	0.5049	1.0000	0				Proximity to ACTL6B associated with Non-specific syndromic intellectual disability (ORPHA:528084): Brachydactyly (HP:0001156)-Short hallux (HP:0010109), Broad hallux (HP:0010055)-Broad hallux (HP:0010055), Broad thumb (HP:0011304)-Broad thumb (HP:0011304), 		
39	RPS6KA5_AR	RPS6KA5	9252	AR	0.2083	0.0300	0.5022	0.5000	0.0000	0.0000	0.0000	0.5022	0.5022	1.0000	0				Proximity to RPS6KA3 associated with Coffin-Lowry syndrome (ORPHA:192): Brachydactyly (HP:0001156)-Brachydactyly (HP:0001156), Craniosynostosis (HP:0001363)-Craniofacial hyperostosis (HP:0004493), Broad hallux (HP:0010055)-Brachydactyly (HP:0001156), Broad thumb (HP:0011304)-Broad finger (HP:0001500), 	Proximity to RPS6KA3 Brachydactyly (HP:0001156)-decreased length of long bones (MP:0004686), Craniosynostosis (HP:0001363)-wide cranial sutures (MP:0030029), Broad hallux (HP:0010055)-decreased length of long bones (MP:0004686), Broad thumb (HP:0011304)-decreased length of long bones (MP:0004686), 	
40	ERN1_AR	ERN1	2081	AR	0.2083	0.0299	0.5019	0.5000	0.0000	0.0000	0.0000	0.5019	0.5019	1.0000	0				Proximity to PSEN1 associated with Familial isolated dilated cardiomyopathy (ORPHA:154): Broad hallux (HP:0010055)-Palmoplantar keratoderma (HP:0000982), Broad thumb (HP:0011304)-Palmoplantar keratoderma (HP:0000982), 	Proximity to PSEN1 Brachydactyly (HP:0001156)-short tail (MP:0000592), Craniosynostosis (HP:0001363)-abnormal sagittal suture morphology (MP:0003843), Broad hallux (HP:0010055)-short tail (MP:0000592), Broad thumb (HP:0011304)-short tail (MP:0000592), 	
41	SMG6_AR	SMG6	23293	AR	0.2087	0.0298	0.5021	0.4995	0.0000	0.0000	0.0000	0.5021	0.5021	1.0000	0				Proximity to SMG9 associated with Heart and brain malformation syndrome (OMIM:616920): Brachydactyly (HP:0001156)-Camptodactyly of finger (HP:0100490), Craniosynostosis (HP:0001363)-Prominent metopic ridge (HP:0005487), Broad hallux (HP:0010055)-Camptodactyly of finger (HP:0100490), Broad thumb (HP:0011304)-Camptodactyly of finger (HP:0100490), 	Proximity to SMG9 Brachydactyly (HP:0001156)-preaxial polydactyly (MP:0009743), Craniosynostosis (HP:0001363)-microphthalmia (MP:0001297), Broad hallux (HP:0010055)-preaxial polydactyly (MP:0009743), Broad thumb (HP:0011304)-preaxial polydactyly (MP:0009743), 	
42	COL6A1_AR	COL6A1	1291	AR	0.2092	0.0294	0.5501	0.4436	0.5501	0.0000	0.0000	0.5055	0.5501	1.0000	0	Congenital muscular dystrophy, Ullrich type (ORPHA:75840): Brachydactyly (HP:0001156)-Slender finger (HP:0001238), Broad hallux (HP:0010055)-Long toe (HP:0010511), Broad thumb (HP:0011304)-Adducted thumb (HP:0001181), 			Proximity to COL10A1 associated with Metaphyseal chondrodysplasia, Schmid type (OMIM:156500): Brachydactyly (HP:0001156)-Short middle phalanx of finger (HP:0005819), Broad hallux (HP:0010055)-Broad middle phalanx of finger (HP:0009844), Broad thumb (HP:0011304)-Broad middle phalanx of finger (HP:0009844), 	Proximity to COL10A1 Brachydactyly (HP:0001156)-abnormal pelvic girdle bone morphology (MP:0004509), Craniosynostosis (HP:0001363)-abnormal endochondral bone ossification (MP:0008272), Broad hallux (HP:0010055)-abnormal pelvic girdle bone morphology (MP:0004509), Broad thumb (HP:0011304)-increased width of hypertrophic chondrocyte zone (MP:0003408), 	
42	RAB6B_AR	RAB6B	51560	AR	0.2094	0.0294	0.5012	0.4986	0.0000	0.0000	0.0000	0.5012	0.5012	1.0000	0					Proximity to TULP3 Brachydactyly (HP:0001156)-abnormal digit morphology (MP:0002110), Broad hallux (HP:0010055)-abnormal digit morphology (MP:0002110), Broad thumb (HP:0011304)-abnormal digit morphology (MP:0002110), 	
44	MZT2A_AR	MZT2A	653784	AR	0.2092	0.0293	0.5078	0.4911	0.0000	0.0000	0.0000	0.5078	0.5078	1.0000	0				Proximity to TOPORS associated with Orofaciodigital syndrome type 6 (ORPHA:2754): Brachydactyly (HP:0001156)-Brachydactyly (HP:0001156), Craniosynostosis (HP:0001363)-Biparietal narrowing (HP:0004422), Broad hallux (HP:0010055)-Foot polydactyly (HP:0001829), Broad thumb (HP:0011304)-Hand polydactyly (HP:0001161), 		
45	HK3_AR	HK3	3101	AR	0.2102	0.0289	0.5015	0.4968	0.0000	0.2748	0.0000	0.5015	0.5015	1.0000	0		Craniosynostosis (HP:0001363)-cataract (MP:0001304), 		Proximity to G6PC3 associated with Dursun syndrome (OMIM:612541): Brachydactyly (HP:0001156)-Clinodactyly (HP:0030084), Broad hallux (HP:0010055)-Clinodactyly (HP:0030084), Broad thumb (HP:0011304)-Broad thumb (HP:0011304), 		
46	UTP20_AR	UTP20	27340	AR	0.2107	0.0287	0.5015	0.4957	0.0000	0.0000	0.0000	0.5015	0.5015	1.0000	0				Proximity to BMS1 associated with Aplasia cutis congenita (ORPHA:1114): Brachydactyly (HP:0001156)-Toe syndactyly (HP:0001770), Craniosynostosis (HP:0001363)-Calvarial skull defect (HP:0001362), Broad hallux (HP:0010055)-Toe syndactyly (HP:0001770), Broad thumb (HP:0011304)-Finger syndactyly (HP:0006101), 	Proximity to BMS1 Craniosynostosis (HP:0001363)-abnormal lens morphology (MP:0001303), 	
47	PPP1R12B_AR	PPP1R12B	4660	AR	0.2106	0.0286	0.5012	0.4957	0.0000	0.0000	0.0000	0.5012	0.5012	1.0000	0				Proximity to PPP1CB associated with Noonan syndrome-like disorder with loose anagen hair 2 (OMIM:617506): Craniosynostosis (HP:0001363)-Craniosynostosis (HP:0001363), Broad thumb (HP:0011304)-Pectus excavatum (HP:0000767), 		
48	GLIS3_AR	GLIS3	169792	AR	0.2124	0.0274	0.5132	0.4774	0.5132	0.0000	0.0000	0.5048	0.5132	1.0000	0	Diabetes mellitus, neonatal, with congenital hypothyroidism (OMIM:610199): Craniosynostosis (HP:0001363)-Sagittal craniosynostosis (HP:0004442), 			Proximity to SUFU associated with Basal cell nevus syndrome (OMIM:109400): Brachydactyly (HP:0001156)-Brachydactyly (HP:0001156), Craniosynostosis (HP:0001363)-Parietal bossing (HP:0000242), Broad hallux (HP:0010055)-Polydactyly (HP:0010442), Broad thumb (HP:0011304)-Short distal phalanx of the thumb (HP:0009650), 	Proximity to SUFU Brachydactyly (HP:0001156)-polydactyly (MP:0000562), Broad hallux (HP:0010055)-polydactyly (MP:0000562), Broad thumb (HP:0011304)-polydactyly (MP:0000562), 	
49	MARK3_AR	MARK3	4140	AR	0.2133	0.0271	0.5017	0.4890	0.0000	0.0000	0.0000	0.5017	0.5017	1.0000	0				Proximity to HDAC4 associated with 2q37 microdeletion syndrome (ORPHA:1001): Brachydactyly (HP:0001156)-Brachydactyly (HP:0001156), Craniosynostosis (HP:0001363)-Frontal bossing (HP:0002007), Broad hallux (HP:0010055)-Toe syndactyly (HP:0001770), Broad thumb (HP:0011304)-Finger syndactyly (HP:0006101), 	Proximity to HDAC4 Brachydactyly (HP:0001156)-abnormal long bone hypertrophic chondrocyte zone (MP:0000165), Craniosynostosis (HP:0001363)-premature lambdoid suture closure (MP:0030356), Broad hallux (HP:0010055)-abnormal long bone hypertrophic chondrocyte zone (MP:0000165), Broad thumb (HP:0011304)-abnormal long bone hypertrophic chondrocyte zone (MP:0000165), 	Proximity to HDAC4 Craniosynostosis (HP:0001363)-anguloarticular premature ossification, abnormal (ZP:0107238), 
50	PRR5L_AR	PRR5L	79899	AR	0.2140	0.0267	0.5072	0.4812	0.0000	0.0000	0.0000	0.5072	0.5072	1.0000	0				Proximity to TELO2 associated with TELO2-related intellectual disability-neurodevelopmental disorder (ORPHA:488642): Brachydactyly (HP:0001156)-Brachydactyly (HP:0001156), Broad hallux (HP:0010055)-4-5 toe syndactyly (HP:0004692), Broad thumb (HP:0011304)-Tapered finger (HP:0001182), 		
51	ADORA2A_AR	ADORA2A	135	AR	0.2139	0.0266	0.5025	0.4864	0.0000	0.2992	0.0000	0.5025	0.5025	1.0000	0		Craniosynostosis (HP:0001363)-abnormal sclera morphology (MP:0002698), 		Proximity to PTH1R associated with Eiken syndrome (OMIM:600002): Brachydactyly (HP:0001156)-Type A1 brachydactyly (HP:0009371), Craniosynostosis (HP:0001363)-Thickened calvaria (HP:0002684), Broad hallux (HP:0010055)-Long hallux (HP:0001847), Broad thumb (HP:0011304)-Broad metatarsal (HP:0001783), 	Proximity to PTH1R Brachydactyly (HP:0001156)-abnormal long bone epiphyseal plate proliferative zone (MP:0003662), Craniosynostosis (HP:0001363)-domed cranium (MP:0000440), Broad hallux (HP:0010055)-abnormal long bone epiphyseal plate proliferative zone (MP:0003662), Broad thumb (HP:0011304)-abnormal long bone epiphyseal plate proliferative zone (MP:0003662), 	
52	TBC1D4_AR	TBC1D4	9882	AR	0.2144	0.0263	0.5059	0.4810	0.0000	0.2782	0.0000	0.5059	0.5059	1.0000	0		Craniosynostosis (HP:0001363)-abnormal lens morphology (MP:0001303), 		Proximity to WNK1 associated with Hereditary sensory and autonomic neuropathy type 2 (ORPHA:970): Brachydactyly (HP:0001156)-Tapered finger (HP:0001182), Craniosynostosis (HP:0001363)-Wormian bones (HP:0002645), Broad hallux (HP:0010055)-Dystrophic toenail (HP:0001810), Broad thumb (HP:0011304)-Tapered finger (HP:0001182), 		
53	THRB_AR	THRB	7068	AR	0.2153	0.0256	0.9281	0.0000	0.2074	0.9281	0.0000	0.5099	0.9281	1.0000	0	Thyroid hormone resistance, autosomal recessive (OMIM:274300): Broad thumb (HP:0011304)-Epiphyseal stippling (HP:0010655), 	Brachydactyly (HP:0001156)-abnormal epiphyseal plate morphology (MP:0006395), Craniosynostosis (HP:0001363)-premature cranial suture closure (MP:0000081), Broad hallux (HP:0010055)-short femur (MP:0003109), Broad thumb (HP:0011304)-abnormal epiphyseal plate morphology (MP:0006395), 		Proximity to TRIP13 associated with Mosaic variegated aneuploidy syndrome (ORPHA:1052): Brachydactyly (HP:0001156)-Clinodactyly of the 5th finger (HP:0004209), Craniosynostosis (HP:0001363)-Frontal bossing (HP:0002007), Broad hallux (HP:0010055)-Clinodactyly of the 5th finger (HP:0004209), Broad thumb (HP:0011304)-Clinodactyly of the 5th finger (HP:0004209), 	Proximity to TRIP13 Brachydactyly (HP:0001156)-abnormal digit morphology (MP:0002110), Craniosynostosis (HP:0001363)-decreased bone mineral density (MP:0000063), Broad hallux (HP:0010055)-abnormal digit morphology (MP:0002110), Broad thumb (HP:0011304)-abnormal digit morphology (MP:0002110), 	
54	KRT10_AR	KRT10	3858	AR	0.2175	0.0244	0.5481	0.4250	0.4626	0.5481	0.0000	0.5079	0.5481	1.0000	0	Ichthyosis with confetti (OMIM:609165): Brachydactyly (HP:0001156)-Clubbing (HP:0001217), Broad hallux (HP:0010055)-Clubbing (HP:0001217), Broad thumb (HP:0011304)-Clubbing (HP:0001217), 	Brachydactyly (HP:0001156)-abnormal autopod morphology (MP:0000572), Broad hallux (HP:0010055)-abnormal autopod morphology (MP:0000572), Broad thumb (HP:0011304)-abnormal autopod morphology (MP:0000572), 		Proximity to NSD1 associated with Weaver syndrome (ORPHA:3447): Brachydactyly (HP:0001156)-Finger syndactyly (HP:0006101), Broad hallux (HP:0010055)-Sandal gap (HP:0001852), Broad thumb (HP:0011304)-Broad thumb (HP:0011304), 		
54	BCAS3_AR	BCAS3	54828	AR	0.2179	0.0244	0.8684	0.0623	0.8684	0.0000	0.0000	0.5025	0.8684	1.0000	0	Non-specific syndromic intellectual disability (ORPHA:528084): Brachydactyly (HP:0001156)-Short hallux (HP:0010109), Broad hallux (HP:0010055)-Broad hallux (HP:0010055), Broad thumb (HP:0011304)-Broad thumb (HP:0011304), 			Proximity to TBX4 associated with 17q23.1q23.2 microdeletion syndrome (ORPHA:261279): Brachydactyly (HP:0001156)-Long toe (HP:0010511), Craniosynostosis (HP:0001363)-Frontal bossing (HP:0002007), Broad hallux (HP:0010055)-Long toe (HP:0010511), Broad thumb (HP:0011304)-Long fingers (HP:0100807), 	Proximity to TBX4 Brachydactyly (HP:0001156)-brachydactyly (MP:0002544), Craniosynostosis (HP:0001363)-abnormal patella morphology (MP:0005353), Broad hallux (HP:0010055)-brachydactyly (MP:0002544), Broad thumb (HP:0011304)-brachydactyly (MP:0002544), 	
56	CDC7_AR	CDC7	8317	AR	0.2179	0.0243	0.5047	0.4736	0.0000	0.0000	0.0000	0.5047	0.5047	1.0000	0				Proximity to ESCO2 associated with Roberts syndrome (ORPHA:3103): Brachydactyly (HP:0001156)-Brachydactyly (HP:0001156), Craniosynostosis (HP:0001363)-Craniosynostosis (HP:0001363), Broad hallux (HP:0010055)-Sandal gap (HP:0001852), Broad thumb (HP:0011304)-Complete duplication of thumb phalanx (HP:0009943), 		Proximity to ESCO2 Craniosynostosis (HP:0001363)-head flat, abnormal (ZP:0000399), 
57	MECOM_AD	MECOM	2122	AD	0.2187	0.0239	0.9213	0.0000	0.4483	0.9213	0.3117	0.5337	0.9213	1.0000	0	Radioulnar synostosis with amegakaryocytic thrombocytopenia 2 (OMIM:616738): Brachydactyly (HP:0001156)-Overlapping fingers (HP:0010557), Broad hallux (HP:0010055)-Overlapping fingers (HP:0010557), Broad thumb (HP:0011304)-Short middle phalanx of the 4th finger (HP:0009295), 	Brachydactyly (HP:0001156)-brachydactyly (MP:0002544), Broad hallux (HP:0010055)-polydactyly (MP:0000562), Broad thumb (HP:0011304)-polydactyly (MP:0000562), 	Craniosynostosis (HP:0001363)-neurocranial trabecula shortened, abnormal (ZP:0000812), 	Proximity to SETBP1 associated with Schinzel-Giedion syndrome (ORPHA:798): Brachydactyly (HP:0001156)-Overlapping fingers (HP:0010557), Craniosynostosis (HP:0001363)-Wormian bones (HP:0002645), Broad hallux (HP:0010055)-Overlapping toe (HP:0001845), Broad thumb (HP:0011304)-Short 1st metacarpal (HP:0010034), 		
58	MEAK7_AR	MEAK7	57707	AR	0.2189	0.0238	0.5936	0.3707	0.0000	0.0000	0.0000	0.5936	0.5936	1.0000	0				Proximity to KIAA0753 associated with ?Orofaciodigital syndrome XV (OMIM:617127): Brachydactyly (HP:0001156)-Postaxial polydactyly (HP:0100259), Broad hallux (HP:0010055)-Broad hallux (HP:0010055), Broad thumb (HP:0011304)-Postaxial polydactyly (HP:0100259), 		
59	CLPB_AR	CLPB	81570	AR	0.2210	0.0228	0.5073	0.4635	0.0000	0.0000	0.0000	0.5073	0.5073	1.0000	0					Proximity to DNAJB12 Brachydactyly (HP:0001156)-abnormal digit morphology (MP:0002110), Broad hallux (HP:0010055)-abnormal digit morphology (MP:0002110), Broad thumb (HP:0011304)-abnormal digit morphology (MP:0002110), 	
60	ITGAL_AR	ITGAL	3683	AR	0.2215	0.0224	0.5037	0.4655	0.0000	0.0000	0.0000	0.5037	0.5037	1.0000	0				Proximity to PRKD1 associated with Congenital heart defects and ectodermal dysplasia (OMIM:617364): Brachydactyly (HP:0001156)-Syndactyly (HP:0001159), Broad hallux (HP:0010055)-Syndactyly (HP:0001159), Broad thumb (HP:0011304)-Broad thumb (HP:0011304), 		
61	TIAM2_AR	TIAM2	26230	AR	0.2230	0.0217	0.5044	0.4612	0.0000	0.0000	0.0000	0.5044	0.5044	1.0000	0				Proximity to SMO associated with Curry-Jones syndrome (ORPHA:1553): Brachydactyly (HP:0001156)-Toe syndactyly (HP:0001770), Craniosynostosis (HP:0001363)-Craniosynostosis (HP:0001363), Broad hallux (HP:0010055)-Toe syndactyly (HP:0001770), Broad thumb (HP:0011304)-Broad thumb (HP:0011304), 	Proximity to SMO Brachydactyly (HP:0001156)-broad limb buds (MP:0004574), Broad hallux (HP:0010055)-broad limb buds (MP:0004574), Broad thumb (HP:0011304)-broad limb buds (MP:0004574), 	Proximity to SMO Broad thumb (HP:0011304)-cleithrum hypoplastic, abnormal (ZP:0011078), 
62	GDF5_AR	GDF5	8200	AR	0.2233	0.0216	0.9116	0.0000	0.8149	0.9116	0.0000	0.5051	0.9116	1.0000	0	Brachydactyly, type A2 (OMIM:112600): Brachydactyly (HP:0001156)-Short 2nd finger (HP:0009536), Broad hallux (HP:0010055)-Broad hallux (HP:0010055), Broad thumb (HP:0011304)-Triangular shaped middle phalanx of the 5th finger (HP:0009182), 	Brachydactyly (HP:0001156)-brachydactyly (MP:0002544), Broad hallux (HP:0010055)-brachydactyly (MP:0002544), Broad thumb (HP:0011304)-brachydactyly (MP:0002544), 		Proximity to FBN1 associated with Weill-Marchesani syndrome 2, dominant (OMIM:608328): Brachydactyly (HP:0001156)-Brachydactyly (HP:0001156), Craniosynostosis (HP:0001363)-Broad skull (HP:0002682), Broad hallux (HP:0010055)-Brachydactyly (HP:0001156), Broad thumb (HP:0011304)-Broad phalanges of the hand (HP:0009768), 	Proximity to FBN1 Brachydactyly (HP:0001156)-short metacarpal bones (MP:0004634), Broad hallux (HP:0010055)-short metacarpal bones (MP:0004634), Broad thumb (HP:0011304)-brachyphalangia (MP:0002543), 	
63	MAML3_AR	MAML3	55534	AR	0.2256	0.0206	0.5023	0.4577	0.0000	0.0000	0.0000	0.5023	0.5023	1.0000	0				Proximity to RBPJ associated with Adams-Oliver syndrome (ORPHA:974): Brachydactyly (HP:0001156)-Brachydactyly (HP:0001156), Craniosynostosis (HP:0001363)-Calvarial skull defect (HP:0001362), Broad hallux (HP:0010055)-Absent toe (HP:0010760), Broad thumb (HP:0011304)-Short distal phalanx of finger (HP:0009882), 	Proximity to RBPJ Craniosynostosis (HP:0001363)-decreased bone mineral density (MP:0000063), 	
64	AGRN_AR	AGRN	375790	AR	0.2259	0.0205	0.5978	0.3495	0.2721	0.5978	0.0000	0.5541	0.5978	1.0000	0	Presynaptic congenital myasthenic syndromes (ORPHA:98914): Broad hallux (HP:0010055)-Pes cavus (HP:0001761), 	Brachydactyly (HP:0001156)-camptodactyly (MP:0003807), Craniosynostosis (HP:0001363)-camptodactyly (MP:0003807), Broad hallux (HP:0010055)-camptodactyly (MP:0003807), Broad thumb (HP:0011304)-camptodactyly (MP:0003807), 		Proximity to LRP4 associated with Cenani-Lenz syndrome (ORPHA:3258): Brachydactyly (HP:0001156)-Short thumb (HP:0009778), Craniosynostosis (HP:0001363)-Frontal bossing (HP:0002007), Broad hallux (HP:0010055)-Toe syndactyly (HP:0001770), Broad thumb (HP:0011304)-Short thumb (HP:0009778), 	Proximity to LRP4 Brachydactyly (HP:0001156)-brachydactyly (MP:0002544), Craniosynostosis (HP:0001363)-fused phalanges (MP:0008730), Broad hallux (HP:0010055)-abnormal digit morphology (MP:0002110), Broad thumb (HP:0011304)-fused phalanges (MP:0008730), 	
65	DCLRE1B_AR	DCLRE1B	64858	AR	0.2261	0.0202	0.5079	0.4493	0.0000	0.0000	0.0000	0.5079	0.5079	1.0000	0				Proximity to SLX4 associated with Fanconi anemia (ORPHA:84): Brachydactyly (HP:0001156)-Toe syndactyly (HP:0001770), Craniosynostosis (HP:0001363)-Dolichocephaly (HP:0000268), Broad hallux (HP:0010055)-Toe syndactyly (HP:0001770), Broad thumb (HP:0011304)-Triphalangeal thumb (HP:0001199), 	Proximity to SLX4 Brachydactyly (HP:0001156)-increased caudal vertebrae number (MP:0010102), Craniosynostosis (HP:0001363)-domed cranium (MP:0000440), Broad hallux (HP:0010055)-increased caudal vertebrae number (MP:0010102), Broad thumb (HP:0011304)-increased caudal vertebrae number (MP:0010102), 	
66	DLGAP1_AR	DLGAP1	9229	AR	0.2267	0.0201	0.5017	0.4557	0.0000	0.3055	0.0000	0.5017	0.5017	1.0000	0		Craniosynostosis (HP:0001363)-abnormal eye morphology (MP:0002092), 		Proximity to DLG4 associated with Non-specific syndromic intellectual disability (ORPHA:528084): Brachydactyly (HP:0001156)-Short hallux (HP:0010109), Broad hallux (HP:0010055)-Broad hallux (HP:0010055), Broad thumb (HP:0011304)-Broad thumb (HP:0011304), 	Proximity to DLG4 Craniosynostosis (HP:0001363)-increased bone mineral content (MP:0010123), 	
66	ADAMTS17_AR	ADAMTS17	170691	AR	0.2264	0.0201	0.9042	0.0000	0.6601	0.9042	0.0000	0.0000	0.9042	1.0000	0	Weill-Marchesani 4 syndrome, recessive (OMIM:613195): Brachydactyly (HP:0001156)-Brachydactyly (HP:0001156), Broad hallux (HP:0010055)-Brachydactyly (HP:0001156), Broad thumb (HP:0011304)-Brachydactyly (HP:0001156), 	Brachydactyly (HP:0001156)-brachydactyly (MP:0002544), Craniosynostosis (HP:0001363)-decreased cranium height (MP:0008525), Broad hallux (HP:0010055)-brachydactyly (MP:0002544), Broad thumb (HP:0011304)-brachyphalangia (MP:0002543), 				
68	SUMF1_AR	SUMF1	285362	AR	0.2272	0.0197	0.9027	0.0000	0.9027	0.5640	0.0000	0.0000	0.9027	1.0000	0	Multiple sulfatase deficiency (OMIM:272200): Brachydactyly (HP:0001156)-Broad hallux (HP:0010055), Broad hallux (HP:0010055)-Broad hallux (HP:0010055), Broad thumb (HP:0011304)-Broad thumb (HP:0011304), 	Brachydactyly (HP:0001156)-abnormal long bone metaphysis morphology (MP:0000133), Craniosynostosis (HP:0001363)-abnormal joint morphology (MP:0002932), Broad hallux (HP:0010055)-abnormal long bone metaphysis morphology (MP:0000133), Broad thumb (HP:0011304)-abnormal long bone metaphysis morphology (MP:0000133), 				
69	PHF11_AR	PHF11	51131	AR	0.2292	0.0189	0.5014	0.4493	0.0000	0.0000	0.0000	0.5014	0.5014	1.0000	0				Proximity to SMARCA2 associated with Nicolaides-Baraitser syndrome (ORPHA:3051): Brachydactyly (HP:0001156)-Brachydactyly (HP:0001156), Broad hallux (HP:0010055)-Clubbing of toes (HP:0100760), Broad thumb (HP:0011304)-Broad distal phalanx of finger (HP:0009836), 		
70	ADAMTSL3_AR	ADAMTSL3	57188	AR	0.2307	0.0183	0.5560	0.3841	0.0000	0.5560	0.0000	0.0000	0.5560	1.0000	0		Brachydactyly (HP:0001156)-abnormal sternum morphology (MP:0000157), Broad hallux (HP:0010055)-abnormal sternum morphology (MP:0000157), Broad thumb (HP:0011304)-abnormal sternum morphology (MP:0000157), 				
70	SPRY4_AD	SPRY4	81848	AD	0.2310	0.0183	0.8951	0.0000	0.2930	0.8951	0.0000	0.5016	0.8951	1.0000	0	Kallmann syndrome (ORPHA:478): Broad hallux (HP:0010055)-Pes cavus (HP:0001761), 	Brachydactyly (HP:0001156)-brachydactyly (MP:0002544), Craniosynostosis (HP:0001363)-abnormal cornea morphology (MP:0001312), Broad hallux (HP:0010055)-abnormal digit morphology (MP:0002110), Broad thumb (HP:0011304)-abnormal digit morphology (MP:0002110), 		Proximity to FGF8 associated with Kallmann syndrome (ORPHA:478): Broad hallux (HP:0010055)-Pes cavus (HP:0001761), 	Proximity to FGF8 Brachydactyly (HP:0001156)-syndactyly (MP:0000564), Broad hallux (HP:0010055)-syndactyly (MP:0000564), Broad thumb (HP:0011304)-syndactyly (MP:0000564), 	
72	DSC2_AR	DSC2	1824	AR	0.2331	0.0173	0.5132	0.4265	0.1739	0.3218	0.0000	0.5132	0.5132	1.0000	0	Arrhythmogenic right ventricular dysplasia 11 with mild palmoplantar keratoderma and woolly hair (OMIM:610476): Broad hallux (HP:0010055)-Palmoplantar keratoderma (HP:0000982), Broad thumb (HP:0011304)-Palmoplantar keratoderma (HP:0000982), 	Craniosynostosis (HP:0001363)-abnormal cornea morphology (MP:0001312), 		Proximity to FOXN1 associated with T-cell immunodeficiency, congenital alopecia, and nail dystrophy (OMIM:601705): Brachydactyly (HP:0001156)-Nail dystrophy (HP:0008404), Broad hallux (HP:0010055)-Nail dystrophy (HP:0008404), Broad thumb (HP:0011304)-Nail dystrophy (HP:0008404), 	Proximity to FOXN1 Brachydactyly (HP:0001156)-abnormal nail morphology (MP:0000579), Broad hallux (HP:0010055)-abnormal nail morphology (MP:0000579), Broad thumb (HP:0011304)-abnormal nail morphology (MP:0000579), 	
73	MCPH1_AR	MCPH1	79648	AR	0.2358	0.0164	0.5021	0.4326	0.0000	0.3618	0.0000	0.5021	0.5021	1.0000	0		Craniosynostosis (HP:0001363)-abnormal lens morphology (MP:0001303), 		Proximity to BRCA2 associated with Fanconi anemia (ORPHA:84): Brachydactyly (HP:0001156)-Toe syndactyly (HP:0001770), Craniosynostosis (HP:0001363)-Dolichocephaly (HP:0000268), Broad hallux (HP:0010055)-Toe syndactyly (HP:0001770), Broad thumb (HP:0011304)-Triphalangeal thumb (HP:0001199), 	Proximity to BRCA2 Brachydactyly (HP:0001156)-abnormal sternum morphology (MP:0000157), Broad hallux (HP:0010055)-abnormal sternum morphology (MP:0000157), Broad thumb (HP:0011304)-abnormal sternum morphology (MP:0000157), 	
74	DUOX2_AR	DUOX2	50506	AR	0.2361	0.0163	0.5115	0.4213	0.5096	0.5115	0.0000	0.5003	0.5115	1.0000	0	Familial thyroid dyshormonogenesis (ORPHA:95716): Brachydactyly (HP:0001156)-Delayed proximal femoral epiphyseal ossification (HP:0008828), Craniosynostosis (HP:0001363)-Delayed cranial suture closure (HP:0000270), Broad hallux (HP:0010055)-Delayed proximal femoral epiphyseal ossification (HP:0008828), Broad thumb (HP:0011304)-Delayed proximal femoral epiphyseal ossification (HP:0008828), 	Brachydactyly (HP:0001156)-small pubis (MP:0004692), Broad hallux (HP:0010055)-small pubis (MP:0004692), Broad thumb (HP:0011304)-short femur (MP:0003109), 		Proximity to SLC39A8 associated with SLC39A8-CDG (ORPHA:468699): Brachydactyly (HP:0001156)-Cutaneous syndactyly of toes (HP:0010621), Craniosynostosis (HP:0001363)-Craniosynostosis (HP:0001363), Broad hallux (HP:0010055)-Cutaneous syndactyly of toes (HP:0010621), Broad thumb (HP:0011304)-Cutaneous syndactyly of toes (HP:0010621), 	Proximity to SLC39A8 Craniosynostosis (HP:0001363)-abnormal retina morphology (MP:0001325), 	Proximity to SLC39A8 Craniosynostosis (HP:0001363)-caudal vertebra fused with caudal vertebra, abnormal (ZP:0130867), 
